Id,Title,Description,LikeCount,DislikeCount,ViewCount,FavoriteCount,CommentCount
VLNjGS20f50,Professional Japanese Samurai Battle It Out In Virtual Reality 360 Video,Samurai may have disappeared with the end of feudal rule in Japan but their legend lives on in the epic battles of the Tsurugikais theatrical sword fighters Now ,300,64,63763,0,31
SxnnOvMFCmQ,EN 43 Lets catch whales in my fishbowl kids education Collecta figure cocostoy,Subscribe CocosToy channel ▷▷▷ httpgoogligiwyC Do you like Dinosaurs I make Dinosaur  Toys battle Video Lets learn about Dinosaurs animals and ,2054,1035,2030230,0,62
vOWxMHI-T50,Worlds Fastest Weapon,Host Paul Shull is on a mission to fix and fire an electric minigun from the Vietnam War a sixbarreled behemoth that could fire up to an astonishing 6000 rounds ,1,5,11,0,2
axySrE0Kg6k,Beauty and the Beast From Beauty and the BeastOfficial Video,On March 17 rediscover a tale as old as time Get your tickets now at httpBeOurGuestcom Beauty and the Beast soundtrack is available now Streaming ,869648,30370,39521799,0,37325
SlHvq9oSIBM,HOW DOES THIS HAPPEN,Get YOUR pair of Maverick Socks HERE ▻ httpwwwFeatsockscomLogan WATCH 5000 Bird Diamond Ring VLOG ▻ httpsyoutubeT2Yf1jUw1po Today ,80901,587,1141480,0,5118
T2Yf1jUw1po,HES GIVING ME HIS CAR IF  need your help,Get YOUR pair of Maverick Socks HERE httpwwwFeatsockscomLogan SUBSCRIBE FOR DAILY VLOGS ▻ httpbitlySubscribe2Logan Today my parrot ,261064,2783,2395716,0,12963
bsO9-a2vvL8,Learn Number  Color with Paw Patrol  Color for Kids and Toddlers Education Cartoon Videos,Learn Number  Color with Paw Patrol  Color for Kids and Toddlers Education Cartoon Videos  Help my channel 100000 Subscriber ,1104,576,634586,0,64
QbGdv0yb5r4,24 Movies That Are Going To Blow Everyone Away In 2018,If youre new Subscribe → httpbitlySubscribetoLooper Movies are big business and major studios earmark their spots on the release schedule years ,16217,1834,3722621,0,2465
dMK_npDG12Q,Lorde  Green Light,Official video for Green Light off the album Melodrama out June 16th  preorder httpsLordelnktomelodramaYT FOLLOW LORDE Website ,571055,41454,32772212,0,44984
PMivT7MJ41M,Bruno Mars  That’s What I Like Official Video,Stream and download Thats What I Like off the new album 24K Magic now httpsatlanticlnktoThatsWhatILike Directed by Bruno Mars and Jonathan Lia ,1660281,38564,97569659,0,70469
LIn8jwTAJpg,FiveYearOld Tavaris and His Terrific Moves Are Back,Tavaris and Ellen had lots to catch up on – his new celebrity status birthday and of course his new dance moves,80952,1544,4393148,0,0
UQmFpJ0sB9Q,Wheel of Musical Impressions with Alicia Keys,Jimmy challenges Alicia Keys to a game of random musical impressions like Gwen Stefani singing Miss Mary Mack and Adele singing The Alphabet Song,140996,5555,11309612,0,5244
duGqrYw4usE,NEW Guardians of the Galaxy Vol 2 Trailer  WORLD PREMIERE,This is the NEW trailer for Guardians of the Galaxy Vol 2 starring Chris Pratt Zoe Saldana and more in theaters May 5th Jimmy Kimmel Reveals What Really ,79598,2381,8040247,0,5855
5-OFPCVH2EI,WHAT I EAT FOR BREAKFAST  HEALTHY PROTEIN PANCAKE RECIPE  PANCAKE DAY,Today is pancake day But these you can make any day of the year These oat pancakes are so simple and really tasty,615,22,16580,0,83
rqMPkxpVyVM,Whats On My Head Challenge Ft Mayim Bialik,Lets put things on our heads and try and guess what they are GMM 1083 Check out Mayims YouTube channel here ,59301,1168,1877500,0,3822
cmdFne7LnuA,Jon Stewart To The Media Its Time To Get Your Groove Back,Worried that the mainstream medias breakup with President Trump has reporters feeling blue Jon Stewart stops by with relationship advice Subscribe To The ,95805,6140,6619668,0,9237
ppTd7PefLe4,SAVAGE LEVEL 113 IF YOU LAUGH YOU LOSE 98 WILL LAUGH AT THIS VIDEO ,SAVAGE LEVEL 113 IF YOU LAUGH YOU LOSE 98 WILL LAUGH AT THIS VIDEO  IF YOU LAUGH YOU LOSE 9997 WILL LAUGH AT THIS ,41711,5388,3745155,0,9639
-7xvqQeoA8c,Introducing Handle,Handle is a research robot that stands 65 ft tall travels at 9 mph and jumps 4​ ​feet vertically ​It uses electric power to operate both electric and hydraulic ,78630,1436,6033362,0,10865
YEGpriv2TAc,Obamacare Last Week Tonight with John Oliver HBO,Congressional Republicans could soon vote to repeal Obamacare John Oliver explores why their replacement plans are similar to a thong Connect with Last ,110725,7711,6510514,0,13915
3TBBP9oLbDM,Jurassic World Dinosaurs By BabyBus Kids learn Dinosaurs With Funny Educational Game App For Kids,Design concepts We focus on inspirational learning We focus on skillbuilding We focus on bringing fun contents to our young audience Take the baby bus for ,1233,705,1123439,0,81
EK4ousC7SSQ,Bruno Mars  Thats What I Like Live from the Brit Awards 2017,Thats What I Like off the new album 24K Magic out now httpsbrunomrs24kMagic See Bruno on the 24K Magic World Tour Tickets on sale now,180682,2625,9042962,0,7099
d4BhfQO5T4U,8 Breakfast Gadgets put to the Test,Alex Wassabi  httpswwwyoutubecomuserhoiitsroi 1 Bacon Express  httpamznto2l4H16Q 2 Bagel Guillotine Slicer  httpamznto2kIO88S 3 Single Cup ,66132,5329,2888115,0,6749
Um7pMggPnug,Katy Perry  Chained To The Rhythm Official ft Skip Marley,Get “Chained To The Rhythm” httpkatytocttr Official video for “Chained to the Rhythm” directed by Mathew Cullen produced by Danny Lockwood Rob ,1475375,81961,103192891,0,88948
uVIX65xDj5A,The Untold Truth Of Game Of Thrones,If youre new Subscribe → httpbitlySubscribetoLooper In 2016 more than 23 million people watched each episode of Game of Thrones eager to find out ,11299,1097,1849490,0,967
sQX_fW4Lmis,Learn Colors and Shapes with Wooden Shape Sorting Clock Educational Toys  Learning Videos for Kids,Learn Colors and Shapes with Wooden Shape Sorting Clock Educational Toys  Learning Videos for Kids HELP US REACH 100000 SUBSCRIBERS,3923,2214,2745247,0,301
ts85mFco1Q8,Colors for Children to Learn with Street Vehicles Toys  Numbers and Colors Videos for Children,Colors for Children to Learn with Street Vehicles Toys  Numbers and Colors Videos for Children 0000  Colors for Children to Learn with Street Vehicles Toys ,0,0,4592980,0,467
JZjAg6fK-BQ,The Weeknd  Reminder,Reminder Official Video Taken from the album Starboy httptheweekndcoStarboyYD XO Official Store httptheweekndcoMR001YD Connect with The ,803197,27098,54805546,0,42012
lCj0A48MV8A,Best Preschool Education Toys for Toddlers Learning Video  Learn Colors Teach Kids Numbers Fun Play,Best Preschool Education Toys for Toddlers Learning Video  Learn Colors Teach Kids Numbers Fun Play In this half hour long educational video for toddlers ,3832,2240,3069599,0,294
CxJfxZsrOKQ,The Most Powerful Helicopter on the Planet  Extreme Helicopter in the Sky,The Most Powerful Helicopter on the Planet  Extreme Helicopter in the Sky,1559,392,810929,0,183
9OpErbTSq5s,Weve all wanted to do this to a printer  Absolute nutters,These guys are hilarious make sure you subscribe and like the video Follow our Social Pages Facebook ,12524,1324,1259832,0,829
gqbyzS8KoSk,Learn Shapes with Wooden Truck Toy  Colors and Shapes Videos Collection for Children,Learn Shapes with Wooden Truck Toy  Colors and Shapes Videos Collection for Children 0000  Learn Shapes with Wooden Truck Toy 0135  Learn Colors ,0,0,7689500,0,688
5q75iR0WYr0,RYAN GETS HIS FIRST iPhone,Ryan gets the iPhone 6s and mom gets the 7s while Jake got moms old phone  also dad scares Ryan when he was heading to the bathroom short and sweet ,16117,762,498845,0,6241
MnAxNUrGrHw,Colors for Children to Learn with Wooden Street Vehicles Toys  Colors and Shapes Video Collection,Colors for Children to Learn with Wooden Street Vehicles Toys  Colors and Shapes Video Collection for Children 0000  Colors for Children to Learn with ,0,0,6907963,0,499
4HI4kxhltkY,The Internet Talent Show,EXTRA JOE httpswwwyoutubecomextrajoevideos MY PODCAST httpwwwsoundcloudcomthebasementyard SPORTS PODCAST ,58999,439,1289982,0,2899
jP1Yey2jOXM,Try Not to Laugh or Grin Challenge  Darius Benson Vines Compilation  Top Viners,Please leave a like if you enjoyed and tell us what you think in the comments Thanks  Also Check Out BEST VINES OF 2016 httpsyoutube3Spl9RERP6Y ,171799,11511,15419662,0,9821
vZIt2fw_Ja4,Learn Your Colors and Numbers 110 Wooden Learning Toys for Kids  Best Learning Videos for Kids,Learn Your Colors and Numbers 110 Wooden Learning Toys for Kids  Best Learning Videos for Kids HELP US REACH 100000 SUBSCRIBERS,8136,4608,5589260,0,652
KGmUhmHNNjg,9 Actors Who Refused Huge Marvel Roles,If youre new Subscribe → httpbitlySubscribetoLooper Landing a role in a Marvel movie means potential stardom for upandcoming actors renewed ,6748,584,1123861,0,1283
pNCG9fHGXB0,TMobile  NSFWireless with Kristen Schaal  60s TV Commercial,Thank you for calling Verizon customer service where we promise to punish you if you go over your data limit Leave the wireless pain to Verizons customers,19301,7749,26094722,0,3101
aQn5wiDyUHo,Google Home  2017 Super Bowl Commercial,Home by you Help by Google Learn more httpsmadebygooglecomhome,6644,1084,1043139,0,594
UWuc18xISwI,Sean Spicer Press Conference Melissa McCarthy  SNL,White House press secretary Sean Spicer Melissa McCarthy and secretary of education nominee Betsy DeVos Kate McKinnon take questions from the press ,212787,11177,25659934,0,18568
ubEIXXkVXE0,C9 vs IMT  TSM vs FLY   LoL Esports  NA LCS Spring 2017  Week 8 Day 2NALCS1,Cloud9 vs Immortals TSM vs FlyQuest Welcome to the 2017 North American League of Legends Championship Series Spring Split lolproleague LCK ,4175,652,1385326,0,0
L83OcYpiwx0,Blippi Dinosaur Song and More  Educational Videos for Preschoolers,The Blippi Dinosaur Song is a fun way for your children to learn about dinosaurs for kids The 1 hour long compilation has more Blippi videos that are ,1296,651,1783178,0,5
NXh8zjoOSis,Best Farm Animal Name Learning Video for Toddlers Preschool Educational Toy Barn with Locking Doors,Best Farm Animal Name Learning Video for Toddlers Preschool Educational Toy Barn with Locking Doors Lets teach toddlers and kids farm animal names and ,4366,2055,4330151,0,594
MrOVhIywofk,MINUSMA Securing Peace In Mali,United Nations  Established by the UN Security Council in 2013 MINUSMA  the UN Multidimensional Integrated Stabilization Mission in Mali  supports ,28,2,1976,0,4
Myo8KT-XFRk,Portland traffic weather and Mt Hood camera,A live look Portlandarea weather I5 at the Marquam Bridge on the East side of the Willamette River and on clear days Mt Hood This camera faces East from ,177,39,30738,0,2
e3Nl_TCQXuw,Beauty and the Beast – US Official Final Trailer,The final trailer for Beauty and the Beast is here On March 17 rediscover a tale as old as time Get your tickets now at BeOurGuestcom  Disneys “Beauty ,203820,6344,21092578,0,18742
JGwWNGJdvx8,Ed Sheeran  Shape of You Official Video,Stream or Download Shape Of You httpsatlanticr2singles ÷ Out Now httpsatlanticrytalbum Subscribe to Eds channel httpbitlySubscribeToEdSheeran ,4368898,133469,464121277,0,155181
Bzb_WmRbQ50,Global Network of ResearchIntensive University Networks 2016 International Annual Meeting,The Global Network of ResearchIntensive University Networks― 2016 International Annual Meeting international conference was held at Keio Universitys ,0,0,429,0,0
Fr48eRrMkdk,Best Learning Video for Kids Cute Kid Genevieve Plays  Learns  Pororo the Little Penguin Toy Bus,Best Learning Video for Kids Cute Kid Genevieve Plays  Learns  Pororo the Little Penguin Toy Bus In this best educational video for kids lets learn colors ,1934,882,1988026,0,276
fsF7enQY8uI,Robot beats I am not a Robot Captcha,Jukin Media Verified  Find this video and others like it by visiting httpswwwjukinmediacomlicensingview949510 For licensing  permission to use please ,265839,8180,7528691,0,11228
Tm7yPGTHZQc,A Deadly Tornados Destruction  The Daily 360  The New York Times,See the devastation in Hattiesburg Miss after a tornado ripped through early Saturday killing four people injuring more than 20 others and destroying homes ,34,3,6022,0,4
qw6oIBo3fvo,Learn to Count Numbers and Letters of the Alphabet Compilation for Children Toddlers and Babies,Learn Numbers to Count Numbers 110 and Letters AZ of the Alphabet for Children Toddlers and Babies This Educational video is a compilation with other ,1579,849,1599877,0,185
prd2RfhF1tM,The 58th Presidential Inauguration of Donald J Trump Full Video   NBC News,Donald Trump was sworn in as the 45th president of the United States on Friday outlining his forceful vision of a new national populism and echoing the same ,83329,106421,10028960,0,11786
ODVxuN6m6E8,Whats Next from Barack and Michelle Obama,The Obama Foundation will be a living working startup for citizenship — an ongoing project for us to shape together what it means to be a good citizen in the ,127150,14840,5290239,0,3
5YgN7CfHXiU,Inside Presidentelect Donald Trumps Cabinet Room  The Daily 360  The News York Times,Sit in the presidents armchair inside the White House cabinet room and listen to Donald J Trumps nominees on some of their toppriority issues Byline ,64,17,10504,0,16
dCsr0CNqB3g,Ellens Tribute to the Obamas,To commemorate President Obamas last day in office Ellen took a look back at some of her favorite moments with President Obama and the First Lady,559378,21721,22188675,0,0
jdh8c01FsrA,Al Franken Embarrasses Trumps Education Pick,During a recent hearing Al Franken quickly realized Betsy DeVos has no idea about anything related to public education Cenk Uygur and John Iadarola hosts ,4777,286,273449,0,1005
e3xBGq3bvcQ,BETSY DEVOS Guns in school protect against grizzly bears,Senator Chris Murphy of Connecticut questioned Presidentelect Trumps pick for secretary of education yesterday at her confirmation hearing Betsy DeVos ,333,77,169806,0,348
0JkxTILe2Nk,QA  A Journey to the Centre of the Sun  with Lucie Green,Lucie Green answers questions from the audience following her talk on solar physics Watch the full talk here httpswwwyoutubecomwatchv0JkxTILe2Nk ,85,1,4554,0,9
VSz9D6J7aUU,Eminem Till I Collapse Remix Karate Kid Music Video,DISCLAIMER I DID NOT CREATE THIS REMIX If you want to find the original remix follow this link ,54087,2390,5045107,0,2014
lGBXAL8PfQ8,Trump To End Net Neutrality,Will Trumps FCC reverse the decision on net neutrality Cenk Uygur and Ana Kasparian hosts of The Young Turks tell you how Trumps FCC could end net ,2951,325,125969,0,939
97wFth-uHVY,Learning Video Collection for Kids  Educational Videos and Nursery Rhymes from Dave and Ava,Learning Video Collection – educational videos and nursery rhymes from Dave and Ava Download Dave and Avas App for IOS ▻ httpsgooglZIDSB6 ,1759,865,1157779,0,289
Ktr0prKP3qs,Best Learning Colors Video Paw Patrol Ice Cream Toy Blender Learn Fruits with Wooden Velcro Toys,RainbowLearning presents learning colors counting and names of fruits with Paw Patrol pups a toy wooden blender playset and wooden velcro toys Have fun ,3712,1765,4649624,0,485
UKmOkwKlKHI,POP LATINO 2017 Megamix hd Luis Fonsi  Maluma  Ozuna  Daddy Yankee  Sean Paul,POP LATINO 2017 Megamix hd Luis Fonsi  Maluma  Ozuna  Daddy Yankee  Sean Paul ツ ¡No te olvides SUSCRIBETE como y compartir la mezcla si le ,16791,2221,5142397,0,419
4_Gf0mGJfP8,Donald Trump Press Conference Cold Open  SNL,Presidentelect Donald Trump Alec Baldwin holds his first press conference since getting elected Get more SNL httpwwwnbccomsaturdaynightlive Full ,114576,24300,12519892,0,26831
lNVQXtTYFok,Learning English Is Fun Official Trailer  ChuChu TV Preschool Educational Language Learning Series,Coming Soon  Learning English Is Fun with a lot of funfilled episodes which will teach English language to your little ones in a way they like This is the first ,2668,1522,2018549,0,32
3twMt_neddY,5 Vintage Gadgets Put to the Test  Part 3,FAN MAIL CRAZY RUSSIAN HACKER PO Box 49 Waynesville NC 28786 Subscribe to my 2nd channel httpswwwyoutubecomuserorigami768 follow me ,35604,1254,2173209,0,8510
fKdFDwhDrVY,Learn Numbers for Toddlers Teach Counting with Genevieve and Cookie Monster on the Go Numbers Toy,Learn Numbers for Toddlers Teach Counting with Genevieve and Cookie Monster on the Go Numbers Toy Today Genevieve wanted to play with Cookie ,6140,3106,7014084,0,696
OOEkauITk3Q,SING  ALL the Movie CLIPS  TRAILERS Compilation  Animation Blockbuster 2016,Get ready for the worlds greatest singing competition  ☆ The MustSee Films to share with your kids  Theyre HERE ▻ httpbitlyFamilyFilms ☆ Subscribe ,59993,11587,50415093,0,4323
cIgKd1SwGLI,This is NTNU,This is NTNU Produced by NTNU Communication Division Technical production film and editing by BERRE AS wwwberreno Visit wwwntnuedu,153,9,12485,0,1
J9i7N6HMico,Learn Shapes with Baby Wooden Shapes Toys Set  Shapes and Colors Videos Collection,Learn Shapes with Baby Wooden Shapes Toys Set  Shapes and Colors Videos Collection 0000  Learn Shapes with Baby Wooden Shapes Toys Set 0245 ,0,0,2372944,0,229
1ml_awEqbEE,10 Things That Will Happen When Humans Go Extinct,top 10 things that will happen if humans disappeared Subscribe to our channel httpgoogl9CwQhg For copyright matters please contact us at ,74655,5491,6712188,0,15494
v3VLDuRpq6k,LEARN ABC PHONICS SHAPES NUMBERS COLORS  Morphle Educational Videos,Download episodes httpwwwmymagicpetmorphlecom In this compilation of the My Magic Pet Morphle cartoon My Red Crane Morphle morphs into all sorts ,0,0,1697250,0,7
II44VNA5m7w,Paw Patrol Best Baby Toy Learning Colors Video Gumballs Cars for Kids Teach Toddlers Preschool,Today we are learning colors colours with paw patrol and gumballs yay We are using different colours colors of toy cars with our paw patrol pups to race each ,2339,1104,3091383,0,452
HIz1x-3Ueo0,Learn Colors and Shapes for Kids Children Toddlers with 3D Wooden Toys for Kids  Colors and Shapes,Learn Colors and Shapes for Kids Children Toddlers with 3D Wooden Toys for Kids  Colors and Shapes HELP US REACH 10000 SUBSCRIBERS,1558,796,1887780,0,250
9P1N7P7-QLI,ESCAPE CODE VR,ESCAPE CODE is a neonsoaked descent into a cyberpunk retro future The film was made entirely in the UNITY video game engine and is driven by a ,64,12,11192,0,20
-5Y56aj-CDE,Enhancing fundamental freedoms through the UNESCO 2005 Convention in 12 developing countries,UNESCO is implementing from 2015 to 2017 with the support of the Swedish Government a project on participatory policy design and monitoring in 12 ,17,2,918,0,0
SAS09pwS9lc,3 AMAZING life hacks you never knew,3 simple life hacks with household items Subscribe to my channel  httpbitly1ODLIwG if you like Life hacks How to projects homemade geeky gadgets and a ,7165,7419,1447198,0,1004
EGUt6zva5jA,Toddler Learning Video for Kids Babies Teach Colors Children Toy Marble Maze Run Race Mania Skytrax,Visit our channel and subscribe httpswwwyoutubecomcFunPlaceCH Toddler Learning Video for Kids Babies Teach Colors Children Toy Marble Maze Run ,1688,724,2637996,0,297
H0VW6sg50Pk,Alien Covenant  Teaser Trailer HD  20th Century FOX,Ridley Scott returns to the universe he created with ALIEN COVENANT a new chapter in his groundbreaking ALIEN franchise The crew of the colony ship ,116995,9922,17445083,0,19848
e1nArZ8gwcU,Best Toddler Learning Video for Kids  Learn Colors Shapes 123s Food Names  Eggs Pororo mores,Best Toddler Learning Video for Kids  Learn Colors Shapes 123s Food Names  Eggs Pororo mores Half Hour Long preschool educational video for ,3921,1798,3719225,0,602
9azGzlvCygA,30 Movies That Are Going To Blow Everyone Away In 2017,If youre new Subscribe → httpbitlySubscribetoLooper Even though 2016 was an epic year for movies it almost feels like a warmup when you look at the ,70918,8847,17138486,0,12027
xhN5Zkm82DA,Learn Shapes Educational Video For Kids,Download episodes httpwwwmymagicpetmorphlecom In this compilation of the My Magic Pet Morphle cartoon Morphle morphs into all sorts of things like a ,0,0,4273545,0,22
nQTwJEfd-5s,Pure Conference Berlin 2016,Elseviers Pure Conference 2016 in Berlin The Pure Community gathered this year in Berlin Germany for our 2nd Pure International Conference This years ,5,0,401,0,0
6DBi41reeF0,Despicable Me 3  Official Trailer  In Theaters Summer 2017 HD,Despicable Me 3  Official Trailer httpwwwdespicableme The team who brought you Despicable Me and the biggest animated hits of 2013 and 2015 ,96764,7583,24547391,0,13220
AFxCO_DyzYM,Bruno Mars Carpool Karaoke,James Corden and Bruno Mars drive through Los Angeles singing his hits including tracks from the new album 24K Magic and chat about everything from ,963244,10625,48304029,0,61411
phr1pOFK1V8,Big Sean  Bounce Back,I DECIDED Available Now httpsmarturlitIDecided Produced by Hitmaka  Smash David Additional Production by Metro Boomin  Amaire Johnson Music ,639967,28630,76382477,0,25960
IJkqxR1H1Sw,EDM  Shuffle Bounce  Melbourne Bounce on Earth EDM Mix 2017  DJ Brothers  Shuffle Dancing,Best Bounce  Progressive House on Earth EDM Mix 2017  DJ Brothers Festival Dancing Shuffle Video 2017 Are you a DJ and want us to promote your mix ,13720,1742,2260840,0,1418
lAkw1M2G5y8,Moana  Best Funny Moments,Help Us Like  Share This Video Dont forget to Subscribe  comment below Thanks Moana Three thousand years ago the greatest sailors in the world ,20506,2638,10021223,0,1173
J4ST8F3_3kU,Educational Videos for Preschoolers with Blippi  Outdoor Park,Play on the outdoor park playground with Blippi and learn This educational video for preschoolers with Blippi is a fun way to learn colors Blippi will make your ,19890,9791,21331715,0,58
vSD55t9nL_A,Greatest Drone Selfie Ever 50 Countries in 4 Years  in 4K,The greatest Epic Aerial Drone Travel Adventure Video of 2016 This was filmed entirely by Drone and piloted by one man Alex Chacon who has traveled the ,2435,269,193484,0,413
CL0yUbSS5Eg,The Shack 2017 Movie Official Trailer – ‘Believe’,The Shack – Now Playing In Theaters Get tickets now httplionsgttheshacktickets Starring Sam Worthington Octavia Spencer Radha Mitchell and Tim ,11999,933,4032475,0,1644
urcgzsOIOB0,Zach King Magic Vines 2016  Best Zach King Magic Tricks,Magic Show from Zach King,42904,2663,9276390,0,1891
013BMMQAly0,Deeyah Khan appointed first UNESCO Goodwill Ambassador for Creativity and Artistic Freedom,Description,10,0,960,0,0
W5NGuraK_3g,Wonder Woman Latest News  update Ares Details Leaked Description Reveals,Wonder Woman Latest News  update Ares Details Leaked Description Reveals  Movie News  Review Hope Your Enjoy  Like Share Comment ,1,0,168,0,1
K1_f-GqaHHo,The Value of Heritage,Have you ever thought about the value of your heritage Whether it is represented by places objects customs values and creative expressions our heritage ,150,8,14929,0,0
i9z0wUUfvPw,Ron White Lates Show 2016 Ron White Stand Up Comedian Special Show,,2424,279,926776,0,214
JUWSLlz0Fdo,Donald Trump Prepares Cold Open  SNL,When faced with making good on his campaign promises presidentelect Donald Trump Alec Baldwin starts to panic Get more SNL ,94086,15613,13324799,0,16526
Hh8sTR2b4zI,Rogue One Recon  A Star Wars 360 Experience,Rogue One Recon is a short immersive 360 experience created by ILMxLAB that is connected to “Rogue One A Star Wars Story” Conflict above all else rules ,11536,215,705041,0,883
WqTLqnhu8Lo,A practical guide to doing business in Europe,A portal for business owners and entrepreneurs who want to startup and expand in other European countries Jargonfree userfriendly available in 24 ,31,7,863,0,1
HOZRYEu2-do,Learning Colors for Toddlers  Teach Babies with Toy Cars Balls Gumballs More  34 Hour Long,Learning Colors for Toddlers  Teach Babies with Toy Cars Balls Gumballs More  34 Hour Long Teach Kids and Babies with fun preschool learning toys for ,18473,9283,20405715,0,2130
JTsMUt9tk-o,Learn Colors and Numbers with Educational Toy Cars and Bus   Colours for Children,Learn Colors and Numbers with Educational Toy Cars and Bus  Colours for Children,0,0,5428730,0,549
ZTpbIPllkQ0,Learn Colors with Tea Time with Tayla  Educational Video for Kids by Brain Candy TV,Lets learn our colors with some cool dump trucks and our special guest Tayla from the popular YouTube channel Tea Time with Tayla Your kids will love ,1620,703,2236626,0,280
mDFF27Nr-EU,Gravitational Waves Albert Einstein to LIGO,Caltech Professor Kip Thorne is interviewed by “Einstein” biographer Walter Issacson as he explains a whole new way of observing the universe – gravitational ,11,0,1287,0,3
FMR2sGVOzq8,Rashida Jones Visits a Syrian Refugee Camp Shot in 360  Vanity Fair,Visiting displaced Syrians in Lebanon Rashida Jones discovers a painful truth These arent wouldbe terrorists sneaking across borders theyre regular ,140,13,12841,0,13
CiatfSQ0xwg,NBA YoungBoy I Aint Hiding WSHH Exclusive  Official Music Video,Watch the official music video for I Aint Hiding by NBA YoungBoy NBA Young Boys 38 Baby coming soon Before I Go out now Download here on Datpiff ,103072,7059,18192259,0,6821
VpDpDF3oees,Register to Vote in 134  voteIRL,1 minute 34 seconds In the US thats all it takes to register to vote A single registration lasts a lifetime of elections Weve made it easy for you here ,5115,8378,987231,0,2973
mi7CyZVitUs,10 Truths About University  Jimmy0010,Here are 10 things I wish I knew about University Subscribe to my channel here httpbitlyJimmy0010 Follow me here Facebook ,4649,61,97473,0,562
JRnOiibGv9s,VlogAfterCollege on starting small and growing his channel  CreatorSpotlight,Armed with a mobile phone and an idea VlogAfterColleges Ryen Lung tested out a few optimization strategies and found out which ones clicked Now hes ,2200,45,56876,0,248
Ga3maNZ0x0w,Global News Coverage on Bloomberg TV,Bloomberg TV brings you the latest in business markets US and global news Csuite executives and our inhouse experts provide indepth analysis on ,7584,3370,4256943,0,11
