Id,Title,Description,LikeCount,DislikeCount,ViewCount,FavoriteCount,CommentCount
u-x33GI2sgY,Trump and Merkel’s awkward handshake moment,President Donald Trumps first meeting with Chancellor Angela Merkel produced a slightly awkward moment when the president didnt shake the German ,3,0,4249,0,6
jjuhPrbvbGg,Trumps awkward visit with Merkel,Body language expert Chris Ulrich decodes the unspoken messages between President Donald Trump and German Chancellor Angela Merkel during their ,397,303,61443,0,800
yr0nrl2v1s0,Chaffetz Trump should share his wiretap evidence,Rep Jason Chaffetz tells CNNs Wolf Blitzer that the Trump administration has not provided any evidence to him or the House Oversight Committee that former ,162,68,17225,0,256
sm0A-zRp9q4,Is there anything more US can do to contain North Korea,Reaction on The First 100 Days after Rex Tillerson says hes taking nothing off the table,161,25,18749,0,157
Bl6_Hpwv0CA,Chaffetz Secret Service failure beyond comprehension,Rep Jason Chaffetz tells CNNs Wolf Blitzer that a man who made it onto the White House grounds came close enough to rattle a door handle a detail not ,82,40,9779,0,130
5JFZNzvOZlU,Breaking down Michigans win over OK State matchup vs Louisville,Michigan beat Oklahoma State 9291 and will face Louisville on Sunday in the NCAA Tournament,12,12,6692,0,14
ivLuMFxrCoY,Lt Col Maginnis Diplomacy has utterly failed the US,Reaction to Secretary Tillersons threat to North Korea,64,5,2202,0,55
0fvmdAfSSLA,The Week in Review  17 March 2017,Top stories from UN News during the week of 13  17 March 2017 featuring The 61st Session of the UN Commission on the Status of Women the conflict in ,11,3,729,0,1
93dDP-O4VsI,WE HAVE 10 DAYS TO GET A MILLION DOLLAR,GOFUNDME  httpswwwgofundmecomLOVEARMYFORSOMALIA American Refugee Committee httparcrelieforgourworksomalia Teen Vogue ,176117,11149,3287035,0,16022
2AM0ns6CYoM,HUMAN FLAGPOLE CHALLENGE muscle test,Get YOUR pair of Maverick Socks HERE ▻ httpwwwFeatsockscomLogan Watch Yesterdays Vlog ▻ httpsyoutubevSc6MOEvR28 Today I became a ,87535,492,1275012,0,4087
HKm_Nigtguc,Healthcare bill will pass pretty quickly Trump,At a news conference with German Chancellor Angela Merkel President Donald Trump says the Republican healthcare plan is coming together beautifully ,7,6,744,0,11
zP1v0tLEBUM,Daniel Jacobs Gennady Golovkin Has Always Looked Vulnerable To Me  SI NOW  Sports Illustrated,Boxing middleweight champion Daniel Jacobs shares his thoughts on Gennady Golvkin and explains why he is the man to give GGG his first loss Subscribe to ,39,28,33035,0,55
Odowe39T3n8,Laptop With Trump Tower Floor Plans Stolen From Secret Service,A laptop was stolen from the Secret Service Click here to read more ,21,21,6242,0,53
uHfyVeI9h1M,Source Intruder was at WH for 15 minutes,The accused White House fence jumper was on the White House south grounds for 15 minutes or more before he was caught a Secret Service source tells ,64,22,6461,0,76
lxXMcK4ptfI,Multi faith protest rallies against Trumps Muslim Ban 2 0 in New York,Hundreds of protesters gathered in Washington Square Park New York Thursday to rally in support of immigrants rights and to condemn US President Donald ,60,316,8735,0,371
glZnkpIDWSE,Zelda Ocarina Controlled Home Automation  Zelda Ocarina of Time  Sufficiently Advanced,With Zelda Breath of the Wild out on the Nintendo Switch I made a home automation system based off the Zelda series using the ocarina from The Legend of ,51089,760,1334696,0,2174
BoQo6mG3zIM,Meals on Wheels recipient How else will I eat,Van Jones speaks to Christa Patton a 68 yearold woman who benefits from the Meals of Wheels program about Pres Trumps budget,216,71,11027,0,444
Fd2ecX4NKrk,Health care bill Trumps budget plan face uphill battle in Congress,The White House and Paul Ryan say they now recognize changes must be made to the GOP health care plan in order to pass Congress while Trumps budget ,19,17,3417,0,27
HTW7FB5Cd0I,Uproar in New Zealand after sniffer dog shot,There is uproar in New Zealand after a runaway sniffer dog was shot dead by police on the tarmac at Auckland Airport Sixteen domestic and international flights ,6,21,3492,0,38
iWs00Ko0Ztc,Trump plans 28 percent cut in budget for diplomacy foreign aid,The United Nations Secretary General has issued a measured response after seeing a blueprint of the proposed White House Federal Budget that points to ,15,3,1594,0,13
ADOpVzEnk6w,Tillerson Patience With North Korea Has Ended,US Secretary of State Rex Tillerson said the policy of strategic patience with North Korea has ended Originally published at ,68,17,14180,0,62
Yka7whNZt-Q,Mount Etna explodes showering BBC crew with rocks and magma,A BBC camera crew captured the exact moment Mount EtnahttpsenwikipediaorgwikiMountEtna exploded as they filmed at Etnas summit on the island of ,27,1,9953,0,7
lUir-hXIns0,Mayor de Blasio emotional about EMT death,A New York City Fire Department emergency medical technician was killed and a second was injured after a man stole their ambulance and struck them in the ,52,78,7291,0,69
5sgaOnY37aA,White House doubles down on Trump Tower surveillance claim,Both the Senate and House Intelligence committees have said theres neither evidence nor any indications that Trump Tower was surveilled let alone whether ,95,23,8995,0,51
DQH41KVzmfQ,Krauthammer No one believes there was Trump wiretap,Syndicated columnist and Fox News contributor Charles Krauthammer Trump seems to believe in conspiracy theories undermines his own credibility as DC is ,106,196,18039,0,268
sIQ4ng0e1GU,Trumps Cruel Budget Caps off Bad Week A Closer Look,Seth takes a closer look at President Trumps latest travel ban block the debunking of his wiretapping claims and his drastic new budget plan » Subscribe to ,31479,3232,3016651,0,4532
T1VUqYW6BQI,Key Senate committee denies credibility of Trumps Obama wiretapping claim,After a growing number of top Republicans  Democrats say there was no proof of Trumps claims the Senate Intelligence Committee ends doubt with their ,61,9,4540,0,40
7hD8OrdFKrc,Rep Paul Ryan No evidence wiretap occured,House Speaker Paul Ryan reacts to the Trump administration standing by its unsubstantiated claim that former President Obama ordered a wiretap on Trump ,202,90,28476,0,231
-Ojvk-4IcOE,Woman interrupted during BBC interview,We have all see the BBC interview where the babies walked in But what if it happened to the mother Subscribe to Jono and Bens YouTube channel ,122704,83761,18561279,0,17017
-86qxS1P0Hs,UKs May rejects Scottish independence referendum call during Brexit talks,British prime minister Theresa May has indicated she would block demands for Scotland to hold an independence referendum in 2018 or 2019 Now is not the ,17,8,2966,0,35
815t8a4XgWo,Mulvaney Trumps budget is compassionate,Director of OMB Mick Mulvaney describes President Trumps proposed budget which cuts 3 billion from block grants used for programs like Meals on Wheels ,60,96,15295,0,120
6q6qDgFsV4w,Trumps budget winners and losers,The big winner in President Trumps proposed budget is defense the losers are the Environmental Protection Agency and the State Department Fred Katayama ,17,22,4594,0,36
DEFD9TSHg_A,Emma Watson Plays With Kittens While Answering Fan Questions,I want them all GET MORE BUZZFEED httpswwwbuzzfeedcom httpswwwbuzzfeedcomvideos httpswwwyoutubecombuzzfeedvideo ,132675,4479,4358607,0,8094
rRbHTeAcJLQ,Reading Mean Comments About My Dogs,Please subscribe to my channel and my vlog channel I make new videos here every Wednesday and make vlogs during my majestical daily life,212756,4613,3300127,0,15347
p1WD_rDHsFc,Selena Gomez Goes Behind the Scenes With Vogue,Follow Selena Gomez on set in Los Angeles with photographers Mert Alas and Marcus Piggott for Vogues April cover Still havent subscribed to Vogue on ,8264,176,277989,0,307
TjKae0DjTRo,Tillerson starts key Asia tour facing US foreign budget cuts,US Secretary of State Rex Tillerson has started his first trip to Asia in Japan a country in the frontline of the North Korean nuclear threat But as his baptism of fire ,5,2,827,0,1
TOKGBmv1VKM,US Secretary of State Rex Tillerson in Tokyo,US Secretary of State Rex Tillerson in Tokyo at the start of his first trip to Asia as President Donald Trumps top diplomat ST VIDEO WALTER SIM,1,1,684,0,0
nu4Pzsolyhg,Crosswalk the Musical Beauty and the Beast,Film stars Josh Gad Dan Stevens and Luke Evans join James theater company for a performance of Beauty and the Beast in the crosswalk of Beverly ,127968,1022,3734912,0,2939
FDIVdjzbrXw,Tillerson snubs press pool for Asian visit,Rex Tillerson has invited a lone reporter to cover his trip to Asia The Committee to Protect Journalists fears the press pools been snubbed for a reason,67,99,6030,0,134
DldepGIYEeY,I CANT DO THIS,I LITERALLY CANT OMG The things I cant do But I can be borderline cute So its cool Thanks for watching babes You CAN stalk my social medias below,447454,3285,4628758,0,12034
jlw-JdrYaX8,Ryan disputes split with Trump on health bill,House Speaker Paul Ryan tells CNNs Jake Tapper that he and the White House are on the same page when it comes to the GOPs Obamacare replacement bill ,65,36,5524,0,54
SOBmmJfC7Dc,I TOOK A SOCCER BALL TO THE worst pain ever Feat F2 Freestylers,Get YOUR pair of Maverick Socks HERE ▻ httpwwwFeatsockscomLogan Watch Yesterdays Vlog ▻ httpsyoutubeiR0JyNhiAuQ Today I let legendary ,93214,762,1427388,0,5603
3VdTq9keTIU,Federal Reserve raises interest rate by quarter point,Fox Business Networks Gerri Willis provides insight on Americas News HQ,36,14,4594,0,21
MDcGnY-vTCA,US indicts Russian spies over 2014 Yahoo data breach,The United States has indicted four individuals including two Russian intelligence officers for the 2014 hack of 500 million Yahoo accounts The indictments ,3,2,204,0,1
V-Cb9x70gYQ,Amtrak Snowmo Collision,Train moving faster than usual plus fresh snow from Stella resulted in a more spectacular arrival than expected  Jukin Media Verified  Find this video and ,96126,4216,11606448,0,7189
MV3V3CNGWq8,Eric Cantor President Trumps Taxes A Win For The White House  Squawk Box  CNBC,Eric Cantor Moelis  Company vice chairman talks about the revelation of President Donald Trumps 2005 tax returns » Subscribe to CNBC ,46,7,5839,0,26
EKxkR0BUvYg,Sen Graham to launch Congressional investigation of Russia,Republican Sen Lindsey Graham tells CNNs Chris Cuomo he is set to speak with FBI Director James Comey about whether or not there is a criminal ,151,129,10038,0,194
Yv0Xk5KZcZE,Creepy Tide Pool Creatures,Please SUBSCRIBE  httpbitlyBWchannel Watch More  httpbitlyBTTseasnake On this episode of Beyond the Tide Coyote discovers some of the most ,85668,3192,5925754,0,8754
zNCz4mQzfEI,Coco Official US Teaser Trailer,Coco opens in US theatres in 3D on November 22 Despite his familys baffling generationsold ban on music Miguel voice of newcomer Anthony Gonzalez ,53685,5321,6416136,0,10061
hoCph_NrL_o,Details of Trumps 2005 tax returns revealed,President Donald Trump paid 38 million in taxes on income of more than 150 million in 2005 the White House confirmed The White House published its ,111,214,11926,0,378
bbXnWCdQzdA,Six Years On WFP Assisting Syrians in the Face of Crisis,Six years have passed Six summers with the length of six long winters since the start of the Syrian Crisis Across Syria millions have lost everything in the surge ,9,0,368,0,0
zUQJX1jkZGE,Learn Colors with Wodden Hammer Educational Toys  Colors Videos Collection for Children,Learn Colors with Wooden Hammer Educational Toys  Colors Videos Collection for Children 0000  Learning Colors Street Vehicles Names and Sounds for ,0,0,1824764,0,128
yX-OznHX0ck,Trump paid 38m in tax in 2005 according to leak,The White House has announced President Donald Trump paid 38 million in taxes in 2005 on a 150 million dollar income It released the information in ,8,9,2956,0,14
QBMffCNnBYQ,Rachel Maddow releases Trumps tax returns,President Trump has refused to release his tax returns bucking tradition going back four decades But on Tuesday night MSNBC announced that it had a copy ,60,135,8596,0,128
0uNZq0bZwh8,Fantasy Phenom NBA DFS 314,Kyle and Mike are back to break down Tuesdays 5 games Interested in receiving the spreadsheets with projections for both Fan Duel and Draft Kings,31,6,575,0,1
1mgXbzJzIZE,Why Is He Called Winnie the Pooh,Finding Winnie  httpamznto2np9Ooh How did they get away with calling a childrens character Pooh In fact none of Winnie the Poohs name seems to ,18464,321,430998,0,3276
N9YrnX4bxQI,CHECK OUT THE BLIZZARD Live Stream,This freakin snow is PISSING ME OFF D OUR REALLY FUN GAMING CHANNEL httpswwwyoutubecomuserSpazBoysGaming VLOGS ABOUT ,157,6,3480,0,39
wwu8XNTGX5o,Honest Trailers  Beauty and the Beast 1991,Take a trip down memory lane with the Disney classic that taught us all that its whats on the inside of your big castle that matters most  Beauty and the Beast,57999,1923,2386917,0,5370
uaIDwz8SIpw,New Zealand Sees Rising Number Of Americans Looking For Citizenship  TIME,A rising number of Americans are looking to move to New Zealand after President Donald Trump took office Subscribe to TIME ▻▻ httppostSubscribeTIME ,36,4,2598,0,23
8hm9ezomDhQ,How Beauty and the Beast Should Have Ended 1991,How Beauty and the Beast Should Have Ended Watch More HISHEs httpsbitlyHISHEPlaylist Subscribe to HISHE httpsbitlyHISHEsubscribe Twitter ,62364,2137,2383153,0,3545
euz-KBBfAAo,Despicable Me 3  In Theaters June 30  Official Trailer 2 HD,Despicable Me 3  Official Trailer httpwwwdespicableme The team who brought you Despicable Me and the biggest animated hits of 2013 and 2015 ,50476,4333,12195187,0,3663
mQsUsCvNLqI,Francois Fillon Charged With Misuse of Public Funds,Mar14  French presidential candidate Francois Fillon has been charged with misuse of public funds one day before his scheduled questioning in the matter,16,2,3367,0,15
gkCRw9QWON8,Winter Storm Stella wreaking havoc for travelers,As Winter Storm Stella pounds the Northeast travelers are facing long delays and cancellations,7,11,2230,0,1
wKEnGoLx0Uk,Blizzard blankets northeastern US,A winter storm packing blizzard conditions blanketing the Northeast overnight and into Tuesday Some 50 million people along the Eastern Seaboard in areas ,8,0,1981,0,1
0MFkN1X2qNQ,Bill Ackman Sells Valeant Stake After 28 Billion Loss,Mar14  Bill Ackman has sold his entire stake in Valeant Pharmaceuticals International Inc and will leave the board after his Pershing Square Capital ,19,2,3522,0,21
KRrE16dPn8U,In headscarf ruling EU court allows religious symbol bans,Employers may bar staff from wearing visible religious symbols the European Unions top court ruled on Tuesday March 14 in its first decision on the issue of ,67,16,4692,0,104
Hwud2_kr1II,Pirates reportedly hijack oil tanker off coast of Somalia,At least eight Sri Lankan crew members were on board the freighter,131,24,15733,0,155
eLAj2ofg7Xo,Dangerous winter storm to slam Northeast,A dangerous winter storm is set to bury the Northeast in a matter of hours Blizzard warnings are in effect for New York City Boston and Philadelphia,50,52,12435,0,92
EakMj3hc2HQ,Kell Brook Signed For Vada Now Its Errol Spence Turn,Dont for get to subscribe to the playlists,103,13,4047,0,62
oqR3glS-K6g,US South Korea to blame for JongNam murder claims Pyongyang,North Koreas Permanent Representative to the UN Kim Inryong has denied that the man assassinated in Malaysia was the halfbrother of North Korean leader ,4,13,2955,0,0
tga4WIGLglc,Senator King is leader of Make America White Again,Sen Bob Menendez was asked about Rep Steve Kings comments about breeding outside western civilization Menendez said the remark was despicable,177,193,9743,0,389
_isYp06LPts,Trumps Lies on Wiretapping Health Care A Closer Look,Seth takes a closer look at Trumps outlandish claims on wiretapping and the Republican plan to repeal and replace Obamacare » Subscribe to Late Night ,37845,5115,2872574,0,5651
l9PncQQJD2g,CBO offers grim predictions under GOP health care bill,A Republican bill to replace Obamacare would lead to 14 million fewer Americans with health insurance by 2018 and 24 million fewer by 2026 the nonpartisan ,9,7,1050,0,33
LHacmw199Jw,Speaker Ryan We have an encouraging score from the CBO,On Special Report the House speaker reacts to the assessment of the Republican health bill,49,67,5423,0,113
jZCL-ny0CAc,CBO estimates 14M will lose coverage under GOP health bill,Speaker Ryan has been bracing for a bad projection Mike Emanuel explains on Special Report,27,1,2443,0,66
QtlUbuPPza4,My Creepiest Childhood Crush  Ass Garden,smarturlitardenrose Today I explore my inner child and how fucking creepy she was Always trying to makeout with cartoons and pop pimples,8138,93,128970,0,1412
xvoV5tmWRFo,DRAG RACING MY BROTHER FOR 10000 Who Will Win,Get YOUR pair of Maverick Socks HERE ▻ httpwwwFeatsockscomLogan Watch Yesterdays Vlog ▻ httpsyoutubeHwKmJHGjGIU SUBSCRIBE FOR ,108542,1487,1500356,0,22308
Vf5EeoAVC0Y,Schumer CBO report should be knockout blow,After the CBO report projected that 24 million fewer Americans will be uninsured by 2026 Democratic Senate Minority Leader Charles Schumer blasted the ,173,93,6638,0,104
yw2R5scjjlQ,Major Winter Storm Seen From Space  Set To Wallop East Coast  Video,The winter storm was tracked by NOAAs GOES16 satellite as it moved across the continental United States It captured the storm in visible infrared and ,5,0,820,0,0
JKkRkakhdtA,Stephen Curry Motion in 360° presented by Degree® Men,Ever wonder what its like to be on the court with Stephen Curry Nows your chance Experience Currys signature moves from a neverbeforeseen perspective ,475,41,85039,0,56
saj1aS4eK3I,Northeastern US bracing for a blizzard,Some area may see up to two feet of snow,52,4,4929,0,86
0n89GZvmeXI,1 Donut Vs 100 Donut,This is truly the best donut I have ever had Check out more awesome videos at BuzzFeedVideo httpbitlyYTbuzzfeedvideo GET MORE BUZZFEED ,205615,10129,8976037,0,17868
IU9mn1_WSlw,GOP sparring over Obamacare repealreplace plan,The Inside Politics panel discuss the infighting within the GOP on how Donald Trump should repeal and replace Obamacare,49,50,9109,0,90
yaU96glpXrI,McCain Provide wiretap evidence or retract,Sen John McCain RAZ said that President Trump should provide evidence for his unsubstantiated claim that former President Barack Obama wiretapped ,373,241,114652,0,522
F7o4oMKbStE,Complicit  SNL,Introducing Complicit a new fragrance for Ivanka Trump Scarlett Johansson Get more SNL httpwwwnbccomsaturdaynightlive Full Episodes ,30687,8615,7217383,0,5291
-SmUVySf85s,Olive Garden  SNL,Actors Scarlett Johansson Mikey Day Leslie Jones Kenan Thompson film reaction shots for an Olive Garden commercial Get more SNL ,22064,1135,2373758,0,1241
MrkJM4JUB28,Alien Attack Cold Open  SNL,President Donald Trump Alec Baldwin addresses members of the military Kenan Thompson Kyle Mooney Aidy Bryant Leslie Jones Sasheer Zamata Beck ,58837,17256,7631035,0,12417
INLzqh7rZ-U,WONDER WOMAN  Official Origin Trailer,This June witness the future of justice WonderWoman  Wonder Woman is in theaters June 2 2017 Follow WonderWoman on social media Facebook ,114449,4020,7294094,0,13186
A4N7G29GWQI,Hilarious Jack Russell Goes Crazy with Excitement at Crufts 2017,Subscribe to Crufts httpbitlyCruftsSub Little Olly the Jack Russell Terrier goes off script in the Rescue Dog Agility at Crufts 2017  Day 2 at ,25949,630,9004204,0,1307
QJzrbE7lXeQ,Violence breaks out after dismissal of South Korean President Park,Progovernment protesters clashed with police on Friday March 10 2017 after South Korean President Park GeunHye was fired by the countrys top court as it ,5,1,2317,0,2
h2vQFCXFRIQ,White House praises jobs report Trump called phony,The White House is celebrating the February jobs report that President Trump once called phony CNNs Tom Foreman reports,64,58,4461,0,82
TaCwWREmKJI,South Korea in political turmoil,Watch South Korea in political turmoil on FTcom httponftcom2npwFiu Clashes erupted outside South Koreas constitutional court on Friday after a landmark ,21,11,5238,0,20
jMlC3kVQj98,WHATS IN THE BOX CHALLENGE Feat My Mom,Get YOUR pair of Maverick Socks HERE ▻ httpwwwFeatsockscomLogan Watch Yesterdays Vlog ▻ httpsyoutubemlhd7anlgI SUBSCRIBE FOR DAILY ,75407,3181,1234769,0,5272
odTEVFBWJ68,Educational Trains for Kids  Blippi Train Song and more,Educate your kids with Blippi train song and other videos in the Blippi trains for kids video Also learn colors with Blippi in the Blue Song in this compilation video,473,266,244703,0,2
ErLnIsx8Dkk,Trump Faces Mounting Conservative Concerns on Health Care,Mar10  In todays Morning Must Read Bloombergs Tom Keene and Francine Lacqua highlight comments on the American Health Care Act from Michael ,37,19,6113,0,29
Mh4f9AYRCZY,Children interrupt BBC News interview  BBC News,There was an unexpected distraction for Professor Robert Kelly when he was being interviewed live on BBC News about South Korea But he managed to keep ,221750,10195,22831472,0,26987
qFLhGq0060w,The Weeknd  I Feel It Coming ft Daft Punk,I Feel It Coming ft Daft Punk Official Video Taken from the album Starboy httpsTheWeekndlnktoIFeelItComingDaftPunkYD Connect with The Weeknd ,773619,20692,35444575,0,59533
6qIkDuerljM,Learn Colors with Beads for Children Toddlers and Babies  Colorful Learning for Kids,Today we Learned Colors with Colorful Beads Those beads came in a Lot of Colours Children Toddlers and Babies love to Learn Colors and Kids Like to Play ,5959,3300,3178974,0,194
cLGIrhKCiYs,Play Doh Shapes Surprise  ABC Songs for Children Kindergarten Kids Learn the Alphabet Toys,Billy  Betty Beaver Open Surprise Eggs with Shapes Inside  Make Colorful Shapes out of Play Doh Children will Learn Colors  Shape Names with this Cute ,0,0,429259,0,48
tt5cldjRBb4,Top 10 HARDEST Achievements in Video Games,Top 10 HARDEST Achievements in Video Games  Subscribe httpgooglQ2kKrD  TIMESTAMPS BELOW  CELEBRATE 10 YEARS OF ,21206,1348,2070405,0,2592
mlhd-7anlgI,CRAZY GUY FLIPPED OVER MY MOM,Get YOUR pair of Maverick Socks HERE ▻ httpwwwFeatsockscomLogan Watch Yesterdays Vlog ▻ httpsyoutubeHhvdFQZULRM Today my mom ,72724,766,1230989,0,5360
usl5u9ruA0U,The Little Mermaid 2017  Official Trailer,New liveaction film inspired by the classic Hans Christian Andersen fairy tale By Conglomerate Media and Kingsway Productions Swimming Summer 2017,0,0,12299841,0,0
9yNor57Jkn8,Are you ready for Daylight Saving Time,The time of year has come and soon clocks will Spring forward We have the need to know info to help you make the big switch,19,9,2165,0,17
5SRdmWBzczA,EHealth CEO  Obamacare replacement will bring down health care premiums,EHealth CEO Scott Flanders explains how the GOP health care plan will lower premium costs for consumers,9,0,577,0,9
RTAAL4J-6s8,UN Chief on Protection Measures from Sexual Exploitation and Abuse,United Nations  Video message by António Guterres United Nations SecretaryGeneral on the launch of the Report Special Measures for Protection from ,22,1,1293,0,4
jeKBMdYaM3U,The Fate of the Furious  In Theaters April 14  Official Trailer 2 HD,The Fate of The Furious  In Theaters April 14 httpwwwfastandfuriouscom On the heels of 2015s Furious 7 one of the fastest movies to reach 1 billion ,86236,5043,9513381,0,7358
64pZcGtOWQM,Samuel L Jackson Acts Out His Film Career w James Corden,Samuel L Jackson and James Corden act out snippets from Samuels legendary film career covering everything from Pulp Fiction to Jurassic Park,66368,1796,4735188,0,3105
HhvdFQZULRM,I LET MY MOM SHAVE MY FACE Bad Idea,Get YOUR pair of Maverick Socks HERE ▻ httpwwwFeatsockscomLogan Watch Yesterdays Vlog ▻ httpsyoutubeCS08CTv7THI Today some ,79591,674,1251745,0,5723
psDUIZsh3eI,I bet You My Kidney You Will LAUGH Funniest Vines EDITION,Dont Laugh at This and Win my other Kidney  httpsyoutubeC8Z0BQukR9E the title is a complete joke,128404,14406,9258900,0,36268
wdw8KNmr2pc,Anne Hathaway on International Womens Day,United Nations  Remarks by Ms Anne Hathaway UN Women Goodwill Ambassador at the UN Observance of International Womens Day 2017 2017 Theme ,612,79,42839,0,85
Vt4Tq89R8u0,Steve Aoki  Louis Tomlinson  Just Hold On Official Video,Steve Aoki  Louis Tomlinson  Just Hold On Available Now httpsmarturlitJustHoldOn Subscribe to Ultra Music ,241753,2579,5076452,0,12591
t7p7ALg1qRg,Trumps Unfounded Accusations of Wiretapping The Daily Show,Without providing any evidence to support his claim President Trump takes to Twitter to accuse former President Obama of wiretapping him in the runup to the ,34640,1061,2064614,0,2442
PWjRMuyXl2o,Future  Use Me,Hndrxx Available at iTunes httpsmarturlitHNDRXX Apple Music httpsmarturlitHNDRXXAM Spotify httpsmarturlitHNDRXXSptfy Google Play ,99576,6228,6542699,0,5842
XM3noFWAMqA,Preschool Learning Toy Cars Video for Toddlers Teach Kids Colors with Tomica Playset Fun Education,Preschool Learning Toy Car Video for Toddlers Teach Kids Colors with Tomica Playset Fun Educational movie for kids In this preschool learning video for ,2201,1330,1790100,0,182
bxMiLwA3qQ4,Emma Watsons Harry Potter Outtake,Jimmy reveals an embarrassing habit that Emma had as a kid when he shows an old outtake of her shooting a scene for Harry Potter President George W Bush ,27682,679,3993868,0,916
pG-_rYw4MpA,2017 North American Golf Innovation Symposium  Improving Facility Productivity,,26,14,4500,0,0
Cb-srOfRqNc,Nintendo Switch painful launch,Switch users experiencing a wide range of different issues from day one Reports are submitted everyday with new pictures and videos Loud crashes errors ,157018,22894,8704041,0,72405
