Id,Title,Description,LikeCount,DislikeCount,ViewCount,FavoriteCount,CommentCount
6eLKBzb6wj8,Welcome to NUS Medicine Class of 2021,Take a glimpse into the life of a medical student at the National University of Singapore,11,0,2839,0,1
9NJj12tJzqc,Moonlight  Official Trailer HD  A24,SUBSCRIBE httpbitlyA24subscribe Winner of 3 Academy Awards® including Best Picture from director Barry Jenkins and starring Naomie Harris André ,34901,4198,11501843,0,6230
8yEgJ-xeoXQ,Louis CK  I Did Some Real Drugs,Buy the full shows httpslouiscknet News  Updates httpslouiscknetnews Tour Dates httpslouiscknettourdates  Louis,5109,170,652196,0,507
hsfkGj_Jd-I,YaleNUS College – In Asia for the world,Established in 2011 YaleNUS College is Singapores first liberal arts college with a full residential programme that integrates living and learning Drawing on ,23,2,4264,0,0
RLykC1VN7NY,Death From Space — GammaRay Bursts Explained,Use the URL httpwwwsquarespacecomnutshell for 10 with a new website and support this channel Also make your life easier Thanks a lot to ,104333,731,3160180,0,11498
xj6vV3T4ok8,Gravitational Waves A New Era of Astronomy Begins,On September 14th 2015 a ripple in the fabric of space created by the violent collision of two distant black holes over a billion years ago washed across the ,5301,276,877005,0,1636
l6zpi90IT1g,Classical Music for Relaxation Music for Stress Relief Relax Music Instrumental Music ♫E024,Classical Music for Relaxation Music for Stress Relief Relax Music Instrumental Music ♫E024  YellowBrickCinemas Relaxing Classical Music is ideal study ,4799,295,2144365,0,215
9eUl4gF0ED4,Harvard graduates unique speech goes viral,Harvard University has called 2016 graduate Donovan Livingstons spokenverse commencement speech one of the most powerful heartfelt student speeches ,32186,1064,1678553,0,2820
JlYKz_vRpNM,A DAY IN THE LIFE OF A UNIVERSITY STUDENT,Day in the life of a university  college student  what a typical day at surrey uni is actually like Instagram  httpswwwinstagramcomstreetorvintage Twitter ,1281,53,123191,0,233
GhmcjZgW_Is,slitherio and other games,its about slitherio abd other games,1,0,26,0,1
ZL4yYHdDSWs,How Far Can We Go Limits of Humanity,Use the URL httpwwwsquarespacecomnutshell for 10 with a new website and support this channel Also make your life easier Thanks a lot to ,148010,1650,4809355,0,20251
SeDOoLwQQGo,STAR WARS 360 VR  Hunting of the Fallen,We are so happy to present you our Star Wars Fanfilm called Hunting of the Fallen 360 VR  The reason why we made this film was simple We love Star Wars ,10928,1198,2919528,0,533
az6oYcd-SfU,9 Futuristic Materials,Learn about some materials that seem like they should belong in science fiction but actually exist today Hosted by Michael Aranda  Support SciShow by ,34677,1014,1834990,0,2446
ZO6Ez7aLMMA,Katt Williams   Kattpacalypse Full,THE MAN HIMSELF YALLWOOOHOOOO,10945,781,2272930,0,1099
BKMgB01MU-w,Suicide Squad Official Trailer 2 2016  Will Smith Margot Robbie Movie HD,READ BELOW FOR EASTER EGGS  HIDDEN REFERENCES Subscribe to TRAILERS httpbitlysxaw6h Subscribe to COMING SOON httpbitlyH2vZUn ,108161,2532,16956241,0,10639
rrDjzS9mQOc,Pucknology After Dark Postgame Coyotes  Sharks 04092016,Follow us on twitter httptwittercompucknology httptwittercompuckguy14 httptwittercomchrisjws httptwittercomajstrong httptwittercomErikLandi ,5,3,458,0,0
Sk8aWkzHUyQ,Welcome to Walk the Prank,Herman is desperate to become a fullfledged member of the Walk the Prank team,84,48,1180,0,0
0JYhK3MB5ss,Best of the UK,Mike and Edd wrap the season with a Best of the UK episode highlighting their favorite moments in and out of the new workshop,1,2,60,0,0
iwawhLtsNJY,Ted Cruz criticizes Trump for flip flopping on foreign po,In an interview with CNNs Wolf Blitzer Ted Cruz criticizes Donald Trump for continually changing his foreign policy positions,50,140,5209,0,37
vU8dCYocuyI,Border Wall Last Week Tonight with John Oliver HBO,Donald Drumpf wants to build a wall on the USMexico border Is his plan feasible Connect with Last Week Tonight online Subscribe to the Last Week ,173278,10070,14584706,0,26885
zsjZ2r9Ygzw,Encryption Last Week Tonight with John Oliver HBO,Strong encryption poses problems for law enforcement is weakening it worth the risks it presents Its…complicated Connect with Last Week Tonight online,106903,2193,7980695,0,7624
WizB1hBO3zg,Parents  Pigskins,Bella fears that her mom is going to be embarrassed at the annual parents and students flag football game Newt and Sawyer worry that Troy has a secret ,15,4,83,0,0
R1vskiVDwl4,10 ways to have a better conversation  Celeste Headlee,When your job hinges on how well you talk to people you learn a lot about how to have conversations — and that most of us dont converse very well Celeste ,59831,706,2765987,0,1503
c6rP-YP4c5I,Shakira  Try Everything Official Video,Zootopia soundtrack featuring “Try Everything” by Shakira is available here httpsmarturlitzsa1 Amazon httpsmarturlitzsama1 Google Play ,1361225,73971,264997018,0,98580
t2q89jtvEq8,Decorah Eagles  North Nest powered by EXPLOREorg,Explore Multicam views comment and post snapshots at httpexploreorg Love Birds  httpgooglzqy2fE Facebook  httpgooglSFRAfX Twitter ,2256,92,4367706,0,0
EH7BGNTtFVE,Ryan Reynolds Gets Naked,The handsome and hilarious actor spilled all the details on filming his intense action scene – while completely nude,46455,950,4732576,0,1692
P1jXaEWRXj0,Try Not To Laugh Vine Edition IMPOSSIBLE CHALLENGE  Best Viners 2016,Try Not To Laugh or Grin While Watching This Challenge if you Laugh you Lose,51329,3593,9977712,0,5150
Yb5ivvcTvRQ,The Choice is Ours 2016 Official Full Version,httpswwwthevenusprojectcom Intro 000 Part 1 616 Part 2 2328 Part 3 4703 Part 4 11909 ProducedDirected by Roxanne Meadows and Joel Holt Script ,21019,881,1336620,0,4214
CQQcGkmuc3w,Around McGill in 80 seconds,Discover why McGill is one of the best universities in the world Apply today mcgillcaadmissions,247,3,57085,0,35
L-Vdfoz7rVQ,Top 10 Chappelles Show Sketches Explicit,You cant have a conversation about sketch comedy series without mentioning this comedians shortlived show Join httpwwwWatchMojocom as we count ,32138,2085,6428099,0,4404
FaOSCASqLsE,Star Wars Undercover Boss Starkiller Base  SNL,Kylo Ren Adam Driver goes undercover as Matt a radar technician at Starkiller Base Subscribe to the SNL channel for more clips httpgoogl24RRTv ,267316,4417,21783546,0,11417
J1S9vdoKFj4,Stanford 2015 Year in Review,A look back at the year that included visits by President Barack Obama and Oprah Winfrey a National Book Award winner groundbreaking research three ,394,3,26774,0,23
ldWU-Wp-ZmQ,Majid Jordan  Something About You Official Video,Something About You Directed by Common Good Majid Jordan Album Preorder Available now httpsmarturlitMajidJordan,41079,2262,4717913,0,1481
u-TNsO33eqQ,How to Paint the Wheels on your Car,Learn how to paint your wheels on your car properly so it looks amazing and lasts a long time I go though the 5 main steps to paint your rims any color you want,50446,2637,6352027,0,5224
LNHBMFCzznE,After watching this your brain will not be the same  Lara Boyd  TEDxVancouver,In a classic researchbased TEDx Talk Dr Lara Boyd describes how neuroplasticity gives you the power to shape the brain you want Recorded at ,62137,3676,7659432,0,3334
JhHMJCUmq28,Quantum Computers Explained – Limits of Human Technology,Where are the limits of human technology And can we somehow avoid them This is where quantum computers become very interesting Check out THE ,125926,875,4779768,0,10589
4_ez2jQdj-w,10 Amazing Experiments You Can Do At Home,Top 10 homemade science tricks that are fun and easy to do Subscribe to our channel httpgoogl9CwQhg For copyright matters please contact us at ,92528,4875,10843319,0,3977
BMaT2nGaEVg,99 Souls  The Girl Is Mine featuring Destinys Child  Brandy Official Video,99 Souls  The Girl Is Mine is out now Get it on iTunes here httpsmarturlitTheGirlIsMineIT Listen to the full track on Spotify httpsmarturlit99SoulsSp Follow ,283819,7883,50423576,0,6163
YTl__F9lzdo,NUS Institutional Video  English,The NUS institutional video captures the distinctive strengths of the University as a distinguished institution of global standing Viewers will have an overview of ,56,3,14717,0,3
rm76WlGvhb4,David Lopez Funny Vines Compilation  Best Vines 2015,Funny Vines from The Best Viners of 2015,35057,1206,5591395,0,2749
ym4uVS-5tSA,10 Roads You Would Never Want to Drive On,Top 10 Most Dangerous Roads and Highways from around the world you should never take your car on Subscribe to our channel httpgoogl9CwQhg For ,151440,25467,86231788,0,10596
4yB_hwKe4Dc,GoPro VR Indycars over the Golden Gate Bridge,GoPro Spherical puts you in the drivers seat of a GoPro IndyCar Cruise along with the pack as they carry the IndyCar trophy across the iconic Golden Gate ,9140,726,1088829,0,413
1GaMGdOQLvg,University British VS American  Evan Edinger  Meowitslucy,University is SUPER different in thE UK VS USA I personally prefer the US ▻SUBSCRIBE for new videos every week httpgoogl65evwQ Lucy ,13913,123,440642,0,1994
51rHWly7sHA,Classic John Pinette        Original Chinese buffet,Subscribe to Ratchet News for more videos  httpsgooglXcV98M,2604,117,684264,0,245
Ne5J4bxWypI,6 Hour Relaxing Piano Music Meditation Music Relaxing Music Soft Music Relaxation Music ☯2423,6 Hour Relaxing Piano Music Meditation Music Relaxing Music Soft Music Relaxation Music ☯2423 – YellowBrickCinemas Instrumental Music includes ,45079,2647,13371110,0,2791
RvOnXh3NN9w,The European Refugee Crisis and Syria Explained,Why is the refugee crisis all over the news How is this related to Syria Why should we care at all Donate to the United Nations Refugee Agency ,172692,51834,10885564,0,52589
ytQ5CYE1VZw,Eminem  Till I Collapse HD,feat Hugh Jackman from the movie REAL STEEL No copyright infringement intended All contents belong to its rightful owners This is for entertainment ,324398,10736,80673674,0,21736
XIYirRNNop8,Himalayan Megastructure Indias largest Hydropower Project  Documentary,Himalayan Megastructure Indias largest Hydropower Project  Documentary Himalayan Megastructure Karcham Wangtoo Hydroelectric Project  Indias ,4175,232,1330072,0,612
6KEeQLPe_S4,TOP 10  UNIVERSITIES OF ASIA 2016,QS ranking Ranking universities of Asia 2015  2016 1 National University of Singapore NUS 2 The University of Hong Kong 3 KAIST  Korea Advanced ,92,24,38175,0,19
vkkfUYcpwjQ,Tibetan Music Healing Music Relaxation Music Chakra Relaxing Music for Stress Relief ☯450A,3 Hour Tibetan Deep Meditation Music Calming Music Shamanic Music Relaxation Music ☯450A  Our relaxing Meditation Music is perfect for Deepak Chopra ,12335,529,2115532,0,425
hxXIJnjC_HI,The Future of Data Science  Data Science  Stanford,Data science holds the potential to impact our lives and how we work dramatically Despite its promise many questions about data science remain How real is ,390,8,50420,0,24
LWhMV3DY3Cc,Snapchat Story My Freshman Year at Stanford in 5 Minutes,This is a collection of about 200 Snapchat videos from my freshman year at Stanford Class of 2018 Skip to 257 for party scenes My Snapchat  Instagram ,1304,46,111831,0,134
Z3oaMQZBIAo,Megastructures  Cruise missile National Geographic Documentary,Megastructures  Cruise missile National Geographic Documentary Largest Digging machine Worlds biggest digging machine national geographic,706,220,408076,0,212
jDaZu_KEMCY,Natalie Portman Harvard Commencement Speech  Harvard Commencement 2015,Academy Awardwinning actress Natalie Portman 03 addresses graduating seniors at Harvards Senior Class Day ceremony on May 27 2015 at Tercentenary ,14474,575,1963297,0,0
GuM8vTq0jd4,Glorious to View Full Version,Cornell University Glorious To View celebrates what makes Cornell University so special—its campus beauty breadth and depth of academics spirit of ,2264,38,280691,0,228
Pw-0pbY9JeU,twenty one pilots Ride Video,twenty one pilots video for Ride from the album Blurryface  available now on Fueled By Ramen Get it on… iTunes httpwwwsmarturlitblurryface Google ,2759877,67968,410043859,0,142216
fGoWLWS4-kU,Tea Consent Clean,Copyright ©2015 Emmeline May and Blue Seat Studios Noncommercial use Video must have copyright information displayed below video with a live link to ,9595,337,3683551,0,972
yo8rgg9dOcc,An Introduction to Indico,A short introduction to Indico an Open Source event management software product developed at CERN Copyright © 2015 CERN Terms of use ,8,1,2410,0,0
rSQNi5sAwuc,How to control someone elses arm with your brain  Greg Gage,Greg Gage is on a mission to make brain science accessible to all In this fun kind of creepy demo the neuroscientist and TED Senior Fellow uses a simple ,25088,308,2067066,0,915
QRFziHZi2gU,Most Beautiful College Campuses,These are the most beautiful college campuses in the world according to over 8000 votes on Rankercom Did your school make the list Take a look and find ,775,100,217788,0,80
6KZ1kvIUFrU,10 Strangest Planets In Space,Space is unbelievably strange You would be forgiven for thinking that every planet out there is similar just a big ball of rock and gas but planets are remarkably ,145471,6890,11796460,0,23322
HfAovWHbO88,Engineering The Strongest Foam in the World,Subscribe to Motherboard Radio today httpappleco1DWdc9d As we race into the future of space travel electric cars and high impact sports some of our ,7204,896,1219483,0,673
BFfHgwgoD2w,Collaboration Software Testimony  Messaging Service Strategy  Zimbra,Hideaki Daimon from BIGLOBE talks about why they chose to use Zimbras collaboration messaging service Highlighting the three main reason why Zimbra ,16,16,5743,0,1
has7kai6rMI,Make Money on YouTube,AdRev can help you make money on YouTube Sign up today and get started httptalentadrevnetr14788 Get these for FREE when you sign up Access to ,0,0,5870456,0,286
Pd9bYdelBX0,Harvard University QA,Last video I asked you guys to send me questions you had about Harvard and you TURNED UP I got somewhere near 200 questions so here are some of my ,4116,123,377152,0,709
uHzgdTPi2CM,Why Are Fewer People Studying Science and Engineering,I went to New York City to talk to a bunch of press people about science education and the need for more graduates with STEM degrees It was part of a ,19567,164,611964,0,3017
XHNiLP_B7vs,The TUM Experience Living in Munich Undergraduate Students,All our undergraduate students at TUM Asia have to travel to Munich Germany to spend their final semester in the universitys home campus A highlight of ,47,7,23678,0,4
MoVyqoLZV7U,Introduction to the MS in Data Science at NYU,What is data science Data science is a rapidly growing academic and professional discipline with applications across countless industries At NYU the MS in ,38,2,21846,0,3
8S0FDjFBj8o,How to sound smart in your TEDx Talk  Will Stephen  TEDxNewYork,This talk was given at a local TEDx event produced independently of the TED Conferences In a hilarious talk capping off a day of new ideas at TEDxNewYork ,85852,1524,4666238,0,2672
6fvPsoidQmI,University of Oregon — Explore the power of if,Explore the power of if We encourage curiosity celebrate discovery and arent afraid to try fail and try again We ask the questions other people dont,0,0,57595,0,0
4a0FbQdH3dY,For the Love of Physics Walter Lewins Last Lecture,On May 16 2011 Professor of Physics Emeritus Walter Lewin returned to MIT lecture hall 26100 for a physics talk and book signing complete with some of his ,39670,649,4028002,0,3314
ct5nX-5x2zA,A Day in Our Life Harvard Swimming,Quick look into the daily practice routine of Harvard Swimming and Diving Check out the 2016 video here httpswwwyoutubecomwatchvabXHO3PvY ,8500,224,1047383,0,703
J8evbCLVepg,Trinity College Dublin,Trinity students and alumni share their Trinity experience stories which helped shape their lives Using production techniques like drone and timelapse filming ,852,25,163800,0,65
HAnw168huqA,Think Fast Talk Smart Communication Techniques,Communication is critical to success in business and life Concerned about an upcoming interview Anxious about being asked to give your thoughts during a ,72620,1692,7525183,0,0
dhQ6vw9zIFE,The University of Chicago Campaign Inquiry and Impact,If you experience any technical difficulties with this video or would like to make an accessibilityrelated request please send a message to ,417,6,61107,0,19
fdVhT_fSJiA,University of Wollongong  Your future is bright,We are a young internationally recognised university thats determined to create positive change at every opportunity Our personalised approach encourages ,91,2,34793,0,1
int3lFioTtU,UC STEREOTYPES EXPLAINED,FUNG BROS MERCH httpgummymallcomfungbros LIKE httpwwwfacebookcomthefungbros FOLLOW httpwwwtwittercomFungBros DAVID ,20173,741,1401414,0,3591
7FfKaIgArJ8,When a physics teacher knows his stuff ,Social Media Manager Manage Pages in social service sites Instagram  Facebook  Twitter  YouTube  Google Plus  LinkedIn like here ,63890,1342,4374407,0,4558
wswxQ3mhwqQ,How to create a WordPress photo  video gallery,WonderPlugin Gallery httpwwwwonderplugincomwordpressgallery is a WordPress photo and video gallery plugin and a great way to showcase your ,9,2,13973,0,2
c9-gOVGjHvQ,How to create a WordPress Carousel Slider in 2 minutes,WonderPlugin Carousel httpwwwwonderplugincomwordpresscarousel is a WordPress plugin that enables you to create responsive carousel slider image ,71,9,69188,0,14
S0poDIyPEl0,Monster Jam World Finals XIII Encore 2012  Grave Digger 30th Anniversary,Monster Jam is the worlds largest and most famous monster truck tour featuring the biggest names in monster trucks including Grave Digger® Maximum ,15849,2775,11443112,0,793
dUwN6GI-0EQ,The Interview,In this film we invited four successful applicants back to Cambridge to share their interview experiences We asked experienced interviewers in four subject ,3375,44,404312,0,90
4D8ezH0iXh8,8 Hour Sleeping Music Music Meditation Delta Waves Deep Sleep Music Relaxing Music ☯177,8 Hour Sleeping Music Music Meditation Delta Waves Deep Sleep Music Relaxing Music ☯177  YellowBrickCinemas Sleep Music is the perfect relaxing ,146287,12125,34763997,0,16215
eIho2S0ZahI,How to speak so that people want to listen  Julian Treasure,Have you ever felt like youre talking but nobody is listening Heres Julian Treasure to help you fix that As the sound expert demonstrates some useful vocal ,123648,2204,10364681,0,3122
H2vN2QXZGnc,Mathematics and sex  Clio Cresswell  TEDxSydney,Never miss a talk SUBSCRIBE to the TEDx channel httpbitly1FAg8hB Mathematics and sex are deeply intertwined From using mathematics to reveal ,24344,3322,5407866,0,3177
Dqx9FYCfheI,School Rainbow Stand up Speak out Stop bullying,In the week leading up to the International Day Against Homophobia and Transphobia our teams of volunteers led by UNESCO UNAIDS Youth Voices Count ,63,1,3902,0,14
wUG0IMjfxCE,George Carlin  Everyday expressions that dont make sense,,6152,199,976399,0,548
MdcuaeYV9oM,Adorable 3 year old is very happy to dance,Adorable 3 year old is very happy to dance Click Here to Subscribe httpbitly10TNEL1 Click Here for the Full Article httpbitly22HnBpA,521349,30392,119898180,0,38295
CDsNZJTWw0w,New bionics let us run climb and dance  Hugh Herr,Hugh Herr is building the next generation of bionic limbs robotic prosthetics inspired by natures own designs Herr lost both legs in a climbing accident 30 years ,61369,791,4196561,0,5808
64ZGXZa_pbM,A Day in the Life at Stanford,Music Best Day of My Life by American Authors i do not hold copyright,296,2,45344,0,16
5EvXrnxCseY,Free Counter Stat Extensions Chrome,Extensions Chrome and Comodo Dragon,10,2,5355,0,1
F8X8ai6xN-4,Using PhD theses in research EThOS,You can download over 100000 theses for free and search over 350000 through the British Library EThOS website Find out how three researchers have used ,18,5,9748,0,0
9GkIj90tBP0,SONGS IN REAL LIFE,Songs in real life   Inspired by steve kardynal   if you like this video dont forget to subscribe Smash like on facebook  httpbitlyphunnyfb Tweet me on Twitter ,139591,18974,25095560,0,10909
nXziVaNNIiw,Rejected from Stanford Accepted to Harvard,Rejected from Stanford accepted to Harvard Like a boss Class of 2016 represent SUBSCRIBE HELP ME MAKE MORE VIDEOS ,7525,1885,660533,0,1551
cNr3r3nT8KE,This is Home  University of Florida,Home is not about where you are but who you are At UF you will learn to discover yourself as a member of the Gator Nation Now and forever a Florida Gator,406,2,82355,0,16
sM7__QIubq4,NTU College of Engineering 2014  Inspiring the next generation of Engineers,At NTU College of Engineering we create a new generation of engineers to lead the industry to bring a brighter tomorrow NTU College of Engineering ,67,1,11289,0,0
QjuWqBzO7qY,How to Repair a Windshield Chip or Crack,DIY Windshield Repair This is a how to fix your chipped windshield If you do not do this as soon as possible the chip can turn into a crack overnight It is easy ,97470,1309,6393628,0,3290
36m1o-tM05g,My philosophy for a happy life  Sam Berns  TEDxMidAtlantic,Never miss a talk SUBSCRIBE to the TEDx channel httpbitly1FAg8hB Sam Berns is a Junior at Foxboro High School in Foxboro Massachusetts where he ,274929,5484,21691715,0,30704
UReja_i7WlA,Top 15 Best Universities in Europe By Country,Watch Best Cities in Central Europehttpyoutube9jkARUqdkE ,246,95,145117,0,77
d0yGdNEWdn0,How to learn any language in six months  Chris Lonsdale  TEDxLingnanUniversity,Never miss a talk SUBSCRIBE to the TEDx channel httpbitly1FAg8hB Chris Lonsdale is Managing Director of Chris Lonsdale  Associates a company ,128772,3272,9957810,0,12386
bh9CRHu8yD0,Experience Penn,The University of Pennsylvania Office of Admissions invites you to Experience Penn See a community where teaching and learning extend across intellectual ,389,17,116641,0,0
C5pKtnmHTxg,Anything Could Happen at Harvard,From Harvard College Admissions and Financial Aid experience undergraduate life at Harvard through the people who know it and love it,5855,166,769449,0,0
XopDVtQLhMs,University of California Berkeley Campus Tour,Tour of one of the flagship campus of University of California UC Berkeley which is ranked as one of the most prestigious universities in the world Located in ,439,28,137925,0,72
7cwUcdpUayQ,Columbia University in the City of New York A Doubled Magic,Columbia University in the City of New York A Doubled Magic Produced for Columbia Athletics and based on the words of Pulitzer Prizewinning Columbia ,1282,18,277689,0,69
r7wdmfd1UJA,Aubrey  Reaction to Harvard Acceptance,Excerpt from the video that I made for Aubreys graduation party Includes her reaction when she found out she was accepted to Harvard class of 2017,7813,456,925482,0,1452
0qHWub21h5c,WelcomeToStanford,During New Student Orientation incoming freshmen and transfer students dive into the academic social and cultural life of Stanford  Special thanks to ,1270,18,216375,0,136
8C_JpoZeUSk,Come to Michigan  University of Michigan,Victors are students who advocate for social justice who work on research projects and who believe in their ideas and inventions Victors are students who ,594,17,122101,0,46
2WqFtiR4-F4,The Worlds Top 10 Universities,The Worlds Top 10 Universities Source QS World University Rankings All images used to create this work were licensed under Creative Commons licenses,434,80,144668,0,145
uShCUp2QYGs,Top 10 Saturday Night Live Sketches,Top 10 Saturday Night Live Sketches Subscribe httpgooglQ2kKrD These are the funniest SNL sketches ever Join WatchMojo as we list our picks for the Top ,30308,3342,13685241,0,6155
SEiSloE1r-A,The surprising beauty of mathematics  Jonathan Matte  TEDxGreensFarmsAcademy,Never miss a talk SUBSCRIBE to the TEDx channel httpbitly1FAg8hB Jonathan Matte has been teaching Mathematics for 20 years the last 13 at Greens ,16788,2395,4510952,0,1925
dEDcc0aCjaA,How to Do a Presentation  5 Steps to a Killer Opener,If you want to know how to do a presentation youve come the right place Watch public speaking and presentation skills expert Jason Teteak give a presentation ,29492,539,2391795,0,974
GNZBSZD16cY,Beatbox brilliance  Tom Thum  TEDxSydney,Never miss a talk SUBSCRIBE to the TEDx channel httpbitly1FAg8hB Tom Thum Armed with just a microphone Thum pushes the limits of the human voice ,676848,11991,56384964,0,33632
YvipzNysA7E,UCD Dublin campus tour with student ambassadors,UCD Student Ambassadors give a 3 minute tour around the University College Dublin Belfield Campus Filmed in summer 2013 the ambassadors show the ,225,7,67442,0,21
73nzMbMDOiw,Preparing Students For the World through Undergraduate Research Bethany Usher at TEDxGeorgeMasonU,Talk given at TEDxGeorgeMasonU April 6th 2013 Read full bios and event information at wwwTEDxGeorgeMasonUcom Dr Bethany Usher spends as much ,40,5,4532,0,0
9No-FiEInLA,Google interns first week,Students who join Google in internships or in fulltime roles work on interesting meaningful projects and are expected to have an impact from the start Meet five ,48584,3300,5795202,0,5572
GMWFieBGR7c,Oprah Winfrey Harvard Commencement speech  Harvard Commencement 2013,Oprah Winfrey who has used her success as a talk show host and media entrepreneur to promote education civic engagement and charitable works ,8941,681,1564428,0,1068
YY2yjEEoB3U,How to discuss a topic in a group,httpwwwengvidcom Five English teachers come together to show you how to discuss a topic in a group Youll learn how to give your opinion interrupt ,6960,255,946470,0,570
E0KVpg3q-tg,Explore Ann Arbor  The University of Michigan,The journey is college Ann Arbor the destination Place no limits on your Michigan experience From the nightlife of Main Street to the glowing skies over Barton ,877,38,163919,0,61
